{
  "schema_version": "1.0",
  "category": "sudoku-puzzles",
  "generated_at": "2026-07-31T10:38:00Z",
  "evidence_mode": "mixed",
  "note": "Gathered via reviewed fetch path (Tier 2 http): ddg search listings + kdpeasy.com pages. amazon/etsy/google-trends are manual-tier (blocked) and NOT fetched; a queries.md pack covers those gaps. Guide sites surfaced in DDG results (lowcontentprofits, publishing-expert, puzzlegenerator) are NOT on the fetch allowlist, so only their result-listing titles/snippets are treated as (weak) market-signal evidence, not fetched content.",
  "findings": [
    {
      "id": "F-001",
      "claim": "Sudoku is ranked the #1 most profitable puzzle-book type on KDP, cited for universal appeal, language-agnostic content, automated generation, and $8-$12 price points.",
      "topic": "trending_types",
      "confidence": "med",
      "tier": "http",
      "verified": true,
      "source_ref": "kdpeasy: 12 KDP Puzzle Book Types Ranked by Profit (2026 Data)",
      "source_url": "https://www.kdpeasy.com/blog/best-puzzle-book-types-kdp",
      "note": "Secondary aggregator claim (kdpeasy is a KDP-tools vendor); dollar figures unverified against primary marketplace data.",
      "captured_at": "2026-07-31T10:38:00Z"
    },
    {
      "id": "F-002",
      "claim": "The 'Bold and Easy' large-print format is cited as the fastest-growing puzzle trend in 2026 (claimed +45% YoY) and commands a $1-$3 price premium over standard formats.",
      "topic": "trending_types",
      "confidence": "low",
      "tier": "http",
      "verified": false,
      "source_ref": "kdpeasy: 12 KDP Puzzle Book Types Ranked by Profit (2026 Data)",
      "source_url": "https://www.kdpeasy.com/blog/best-puzzle-book-types-kdp",
      "note": "Growth percentage is a vendor claim with no primary source; treat direction as a hypothesis, not the exact figure.",
      "captured_at": "2026-07-31T10:38:00Z"
    },
    {
      "id": "F-003",
      "claim": "A 'Sudoku Variations' segment (Killer, Samurai, Jigsaw) exists as a live adult sub-category, appearing repeatedly as book titles in marketplace search listings.",
      "topic": "trending_types",
      "confidence": "med",
      "tier": "http",
      "verified": true,
      "source_ref": "ddg search: 'killer sudoku samurai jigsaw sudoku variety puzzle book for adults'",
      "source_url": "https://html.duckduckgo.com/html/?q=killer+sudoku+samurai+jigsaw+sudoku+variety+puzzle+book+for+adults",
      "note": "Evidence is result-listing titles (existence of titles), not sales data.",
      "captured_at": "2026-07-31T10:38:00Z"
    },
    {
      "id": "F-004",
      "claim": "A kids sudoku segment using 4x4 / 6x6 (and stepping up to 9x9) grids for children roughly ages 4-12 is live, appearing repeatedly as book titles in marketplace search listings.",
      "topic": "trending_types",
      "confidence": "med",
      "tier": "http",
      "verified": true,
      "source_ref": "ddg search: 'sudoku for kids 4x4 6x6 mini sudoku puzzle book children'",
      "source_url": "https://html.duckduckgo.com/html/?q=sudoku+for+kids+4x4+6x6+mini+sudoku+puzzle+book+children",
      "note": "Result-listing titles evidence; age framing (4-8, 6-12, 8-12) varies by title.",
      "captured_at": "2026-07-31T10:38:00Z"
    },
    {
      "id": "F-005",
      "claim": "The primary sudoku buyer is described as adult, with average buyer age skewing 35-70; large-print/senior and kids formats are called out as growing sub-segments.",
      "topic": "audiences",
      "confidence": "med",
      "tier": "http",
      "verified": true,
      "source_ref": "kdpeasy: sudoku niche page + puzzle-types ranking",
      "source_url": "https://www.kdpeasy.com/niches/sudoku-puzzles",
      "note": "Vendor market page; age band is a stated range, not primary demographic data.",
      "captured_at": "2026-07-31T10:38:00Z"
    },
    {
      "id": "F-006",
      "claim": "Large-print sudoku for seniors is a distinct, essential-format audience; senior-care-facility bulk purchases are cited as a demand driver and 8.5x11 large print is called essential for this audience.",
      "topic": "audiences",
      "confidence": "med",
      "tier": "http",
      "verified": true,
      "source_ref": "kdpeasy: sudoku niche page (Bestsellers to study)",
      "source_url": "https://www.kdpeasy.com/niches/sudoku-puzzles",
      "note": "Bulk-purchase claim is unverified vendor assertion; the large-print-for-seniors format itself is corroborated by search listings (F-004 pattern).",
      "captured_at": "2026-07-31T10:38:00Z"
    },
    {
      "id": "F-007",
      "claim": "Common sudoku trim sizes on KDP are 6x9 and 8.5x11 (8.5x11 for large-print/senior), on white 60lb paper, with typical page counts of 100-200 pages.",
      "topic": "size_norms",
      "confidence": "med",
      "tier": "http",
      "verified": true,
      "source_ref": "kdpeasy: sudoku niche page (Market intelligence)",
      "source_url": "https://www.kdpeasy.com/niches/sudoku-puzzles",
      "note": "Advisory only per rule 20; the design-policy engine is authoritative at project init.",
      "captured_at": "2026-07-31T10:38:00Z"
    },
    {
      "id": "F-008",
      "claim": "Volume-anchored formats ('1000 Sudoku Puzzles') are a live pattern that sustains higher list prices ($14.99-$16.99) via perceived value.",
      "topic": "size_norms",
      "confidence": "med",
      "tier": "http",
      "verified": true,
      "source_ref": "kdpeasy: sudoku niche page (Bestsellers to study)",
      "source_url": "https://www.kdpeasy.com/niches/sudoku-puzzles",
      "note": "Price band is a vendor estimate; treat as pricing hypothesis, not committed price.",
      "captured_at": "2026-07-31T10:38:00Z"
    },
    {
      "id": "F-009",
      "claim": "Difficulty-tiered series (Easy / Medium / Hard / Expert as separate books) is a recommended structure that increases per-buyer revenue vs a single mixed-difficulty book, and color-coded difficulty (blue/green/red) creates a collectible set.",
      "topic": "positioning",
      "confidence": "med",
      "tier": "http",
      "verified": true,
      "source_ref": "kdpeasy: sudoku niche page (pricing math + cover tips)",
      "source_url": "https://www.kdpeasy.com/niches/sudoku-puzzles",
      "note": "Strategy advice from a KDP-tools vendor; directionally consistent across the page.",
      "captured_at": "2026-07-31T10:38:00Z"
    },
    {
      "id": "F-010",
      "claim": "The sudoku niche is characterized as High demand and High competition, with a typical price band of $6.99-$10.99 and a BSR sweet spot around top 2,500 in Books > Humor & Entertainment > Puzzles & Games > Sudoku.",
      "topic": "saturation",
      "confidence": "med",
      "tier": "http",
      "verified": true,
      "source_ref": "kdpeasy: sudoku niche page (Market intelligence)",
      "source_url": "https://www.kdpeasy.com/niches/sudoku-puzzles",
      "note": "Vendor-reported; BSR/price bands not verified against live Amazon data (manual tier blocked).",
      "captured_at": "2026-07-31T10:38:00Z"
    },
    {
      "id": "F-011",
      "claim": "High-converting sudoku title formulas follow patterns like '[Difficulty] Sudoku for [Audience]: [Number] Puzzles to [Benefit]', 'Large Print Sudoku Puzzle Book for Seniors: [Number] Puzzles with Solutions', 'Sudoku for Beginners: [Number] Step-by-Step Puzzles with Tips & Full Solutions', and 'Daily Sudoku ... for Brain Health'.",
      "topic": "seo",
      "confidence": "med",
      "tier": "http",
      "verified": true,
      "source_ref": "kdpeasy: sudoku niche page (Title formulas)",
      "source_url": "https://www.kdpeasy.com/niches/sudoku-puzzles",
      "note": "Title templates; ensure any concrete counts/difficulty match verified generated content before use.",
      "captured_at": "2026-07-31T10:38:00Z"
    },
    {
      "id": "F-012",
      "claim": "High-intent sudoku keyword ideas include: 'sudoku puzzle book for adults', 'large print sudoku for seniors', 'easy sudoku for beginners', 'hard sudoku puzzles', 'expert level sudoku', 'brain games for seniors', 'daily sudoku puzzle book', 'medium difficulty sudoku book', 'sudoku with solutions', '1000 sudoku puzzles book'.",
      "topic": "seo",
      "confidence": "med",
      "tier": "http",
      "verified": true,
      "source_ref": "kdpeasy: sudoku niche page (Keywords)",
      "source_url": "https://www.kdpeasy.com/niches/sudoku-puzzles",
      "note": "Rights-safe generic terms; none are trademarks. Validate against channel tag limits at listing time.",
      "captured_at": "2026-07-31T10:38:00Z"
    },
    {
      "id": "F-013",
      "claim": "Sudoku books list under the Amazon browse path Books > Humor & Entertainment > Puzzles & Games > Sudoku; corresponding BISAC is the Games & Activities > Puzzles family (e.g. GAM013000 Puzzles / GAM022000 Sudoku).",
      "topic": "categories",
      "confidence": "low",
      "tier": "http",
      "verified": false,
      "source_ref": "kdpeasy: sudoku niche page (BSR path); BISAC code inferred",
      "source_url": "https://www.kdpeasy.com/niches/sudoku-puzzles",
      "note": "Browse path is from the vendor page; exact BISAC code should be confirmed via the BISAC finder / official list before listing.",
      "captured_at": "2026-07-31T10:38:00Z"
    },
    {
      "id": "F-014",
      "claim": "Marketplace guides warn that reusing identical generator templates and shipping difficulty-inconsistent puzzles harms reviews; the recommended fixes are original puzzles with unique solution paths, consistent per-book difficulty, and back-of-book solutions with clear puzzle numbering.",
      "topic": "positioning",
      "confidence": "med",
      "tier": "http",
      "verified": true,
      "source_ref": "kdpeasy: sudoku niche page (Avoidable traps)",
      "source_url": "https://www.kdpeasy.com/niches/sudoku-puzzles",